{
  "approvals": [
    {
      "created_at": "2026-04-02T09:30:12Z",
      "id": "approval-001",
      "reason": "The next step writes the first working implementation.",
      "responded_at": "2026-04-02T09:30:15Z",
      "response_note": "Proceed with the first working implementation.",
      "run_id": "run-smoke-001",
      "scope": "workspace-write",
      "status": "approved",
      "step_id": "step-002",
      "title": "Approve the first implementation pass"
    }
  ],
  "artifacts": [
    {
      "id": "artifact-001",
      "kind": "run_summary",
      "label": "P1 contract summary",
      "path": ".ai-collab/artifacts/run-smoke-001/summary.md",
      "preview": "Run created, planned, stepped, approved, and persisted.",
      "registered_at": "2026-04-02T09:30:18Z",
      "run_id": "run-smoke-001"
    }
  ],
  "event_count": 7,
  "last_sequence": 7,
  "plan": {
    "generated_at": "2026-04-02T09:30:03Z",
    "id": "plan-001",
    "steps": [
      {
        "assignee": "codex",
        "completed_at": "2026-04-02T09:30:09Z",
        "done_when": "Confirm the current scope, constraints, and evidence needed for Validate the Rust P0/P1 backend contract.",
        "eta_minutes": 15,
        "id": "step-001",
        "stage": "collect",
        "started_at": "2026-04-02T09:30:06Z",
        "status": "completed",
        "summary": "Collected the initial scope and constraints.",
        "title": "Collect current context for: Validate the Rust P0/P1 backend contract"
      },
      {
        "assignee": null,
        "completed_at": null,
        "done_when": "Produce a first working implementation that directly advances Validate the Rust P0/P1 backend contract.",
        "eta_minutes": 45,
        "id": "step-002",
        "stage": "execute",
        "started_at": null,
        "status": "pending",
        "summary": null,
        "title": "Build the first working iteration for: Validate the Rust P0/P1 backend contract"
      },
      {
        "assignee": null,
        "completed_at": null,
        "done_when": "Verify the first working result for Validate the Rust P0/P1 backend contract and record any follow-up risk.",
        "eta_minutes": 20,
        "id": "step-003",
        "stage": "validate",
        "started_at": null,
        "status": "pending",
        "summary": null,
        "title": "Validate the first working iteration for: Validate the Rust P0/P1 backend contract"
      }
    ],
    "version": 1
  },
  "run": {
    "controller": "codex",
    "created_at": "2026-04-02T09:30:00Z",
    "id": "run-smoke-001",
    "phase": "ready",
    "task": "Validate the Rust P0/P1 backend contract",
    "updated_at": "2026-04-02T09:30:20Z",
    "workspace": "/workspace/demo"
  }
}